{"all_required_propositions_evaluable_and_supported":false,"analyzer_sha256":"2bc4dba0d7aef5a7d08ef42c34cc730235a37e8b303f2454d5bb905089a73b18","attack_catalog_sha256":"098563afc029f8c1532999e3cc5c058c8bf3bdc33cfcfd01423decf56f4693b1","authorization_blockers":["analysis summaries cannot self-authorize manuscript claims","independent exact-byte review and external reproduction require separate authenticated records","one or more required propositions are unsupported, incomplete, or not evaluable","input is a synthetic dummy ledger"],"category_counts":{"ACCEPT":759,"ERROR":1,"GENERATION_FAILURE":4,"MISSING_EXECUTION":1,"REJECT":715},"category_sum_matches_denominator":true,"classification":"dummy_no_confirmatory_evidence","compatibility_matrix_sha256":"4de12c8c03c4227619986c63f3532047c3bcff3a960bb7bac40ccfebaa1031a1","conformance_mismatch_count":8,"conformance_mismatch_row_ids":["B01-TABULAR--ATTESTATION-MALFORMED-001--ENV-AUTHOR--P0","B01-TABULAR--ATTESTATION-MALFORMED-001--ENV-AUTHOR--P1","B01-TABULAR--ATTESTATION-MALFORMED-001--ENV-AUTHOR--P2","B01-TABULAR--ATTESTATION-MALFORMED-001--ENV-AUTHOR--P3","B01-TABULAR--ATTESTATION-MISSING-001--ENV-AUTHOR--P0","B01-TABULAR--BUILDER-PREDICATE-MISMATCH-001--ENV-AUTHOR--P1","B01-TABULAR--CERTIFICATE-TIME-001--ENV-AUTHOR--P2","B01-TABULAR--CLEAN-001--ENV-LINUX-PINNED--P3"],"input_schema_sha256":"aeb5b3685f1bd4b9bae337b2d6199cfee4621d1ad00e94353b82884cd8189f9f","input_sha256":"da96c003bd087d01489075c585256a55a478696b7b94e2db9e79cbf3356a6ee3","manuscript_claims_authorized":false,"oracle_sha256":"23a21bcfc834bd2638e283964f40e5129ee151f5c798a6eb1197be2c26403295","output_schema_sha256":"5927dd0c1b197ecfa1be511ef500652dd02dd3f1e47fc2918e042f30d0a386ae","planned_row_count":1480,"proposition_matrix_sha256":"8cea1e3341c716f287d7ac2cdb9ad2ae7529729f1dde9294a523051b8dcf8ff5","propositions":[{"abstract_eligible":false,"category_counts":{"ACCEPT":759,"ERROR":1,"GENERATION_FAILURE":4,"MISSING_EXECUTION":1,"REJECT":715},"conclusion_eligible":false,"id":"PR-001","mismatch_count":8,"mismatch_row_ids":["B01-TABULAR--ATTESTATION-MALFORMED-001--ENV-AUTHOR--P0","B01-TABULAR--ATTESTATION-MALFORMED-001--ENV-AUTHOR--P1","B01-TABULAR--ATTESTATION-MALFORMED-001--ENV-AUTHOR--P2","B01-TABULAR--ATTESTATION-MALFORMED-001--ENV-AUTHOR--P3","B01-TABULAR--ATTESTATION-MISSING-001--ENV-AUTHOR--P0","B01-TABULAR--BUILDER-PREDICATE-MISMATCH-001--ENV-AUTHOR--P1","B01-TABULAR--CERTIFICATE-TIME-001--ENV-AUTHOR--P2","B01-TABULAR--CLEAN-001--ENV-LINUX-PINNED--P3"],"not_evaluable_reasons":[],"planned_row_count":1480,"required_negative_wording":true,"status":"FALSIFIED_OR_INCOMPLETE","would_support_positive_wording":false},{"abstract_eligible":false,"category_counts":{"ACCEPT":0,"ERROR":0,"GENERATION_FAILURE":0,"MISSING_EXECUTION":0,"REJECT":72},"conclusion_eligible":false,"id":"PR-002","mismatch_count":0,"mismatch_row_ids":[],"not_evaluable_reasons":[],"planned_row_count":72,"required_negative_wording":false,"status":"SUPPORTED","would_support_positive_wording":true},{"abstract_eligible":false,"category_counts":{"ACCEPT":0,"ERROR":0,"GENERATION_FAILURE":0,"MISSING_EXECUTION":0,"REJECT":48},"conclusion_eligible":false,"id":"PR-003","mismatch_count":0,"mismatch_row_ids":[],"not_evaluable_reasons":["required authenticated manifest/provenance observables are not present in observation-ledger.v1"],"planned_row_count":48,"required_negative_wording":true,"status":"NOT_EVALUABLE","would_support_positive_wording":false},{"abstract_eligible":false,"category_counts":{"ACCEPT":36,"ERROR":0,"GENERATION_FAILURE":0,"MISSING_EXECUTION":0,"REJECT":0},"conclusion_eligible":false,"id":"PR-004","mismatch_count":0,"mismatch_row_ids":[],"not_evaluable_reasons":[],"planned_row_count":36,"required_negative_wording":false,"status":"SUPPORTED","would_support_positive_wording":true},{"abstract_eligible":false,"category_counts":{"ACCEPT":12,"ERROR":0,"GENERATION_FAILURE":0,"MISSING_EXECUTION":0,"REJECT":0},"conclusion_eligible":false,"id":"PR-005","mismatch_count":0,"mismatch_row_ids":[],"not_evaluable_reasons":[],"planned_row_count":12,"required_negative_wording":false,"status":"SUPPORTED","would_support_positive_wording":true},{"abstract_eligible":false,"category_counts":{"ACCEPT":0,"ERROR":0,"GENERATION_FAILURE":0,"MISSING_EXECUTION":0,"REJECT":36},"conclusion_eligible":false,"id":"PR-006","mismatch_count":0,"mismatch_row_ids":[],"not_evaluable_reasons":["required authenticated manifest/provenance observables are not present in observation-ledger.v1"],"planned_row_count":36,"required_negative_wording":true,"status":"NOT_EVALUABLE","would_support_positive_wording":false},{"abstract_eligible":false,"category_counts":{"ACCEPT":47,"ERROR":0,"GENERATION_FAILURE":0,"MISSING_EXECUTION":0,"REJECT":1},"conclusion_eligible":false,"id":"PR-007","mismatch_count":1,"mismatch_row_ids":["B01-TABULAR--CLEAN-001--ENV-LINUX-PINNED--P3"],"not_evaluable_reasons":[],"planned_row_count":48,"required_negative_wording":true,"status":"FALSIFIED_OR_INCOMPLETE","would_support_positive_wording":false},{"abstract_eligible":false,"category_counts":{"ACCEPT":712,"ERROR":1,"GENERATION_FAILURE":4,"MISSING_EXECUTION":1,"REJECT":714},"conclusion_eligible":false,"id":"PR-008","mismatch_count":0,"mismatch_row_ids":[],"not_evaluable_reasons":[],"planned_row_count":1432,"required_negative_wording":false,"status":"DESCRIPTIVE_COMPLETE","would_support_positive_wording":false},{"abstract_eligible":false,"category_counts":{"ACCEPT":759,"ERROR":1,"GENERATION_FAILURE":4,"MISSING_EXECUTION":1,"REJECT":715},"conclusion_eligible":false,"id":"PR-009","mismatch_count":24,"mismatch_row_ids":["B01-TABULAR--ATTESTATION-MALFORMED-001--ENV-AUTHOR--P0","B01-TABULAR--ATTESTATION-MALFORMED-001--ENV-AUTHOR--P1","B01-TABULAR--ATTESTATION-MALFORMED-001--ENV-AUTHOR--P2","B01-TABULAR--ATTESTATION-MALFORMED-001--ENV-AUTHOR--P3","B01-TABULAR--ATTESTATION-MALFORMED-001--ENV-LINUX-PINNED--P0","B01-TABULAR--ATTESTATION-MALFORMED-001--ENV-LINUX-PINNED--P1","B01-TABULAR--ATTESTATION-MALFORMED-001--ENV-LINUX-PINNED--P2","B01-TABULAR--ATTESTATION-MALFORMED-001--ENV-LINUX-PINNED--P3","B01-TABULAR--ATTESTATION-MISSING-001--ENV-AUTHOR--P0","B01-TABULAR--ATTESTATION-MISSING-001--ENV-LINUX-PINNED--P0","B01-TABULAR--BUILDER-PREDICATE-MISMATCH-001--ENV-AUTHOR--P1","B01-TABULAR--BUILDER-PREDICATE-MISMATCH-001--ENV-LINUX-PINNED--P1","B01-TABULAR--CERTIFICATE-TIME-001--ENV-AUTHOR--P2","B01-TABULAR--CERTIFICATE-TIME-001--ENV-LINUX-PINNED--P2","B01-TABULAR--CLEAN-001--ENV-AUTHOR--P3","B01-TABULAR--CLEAN-001--ENV-LINUX-PINNED--P3","B01-TABULAR--CONTENT-BITFLIP-001--ENV-AUTHOR--P0","B01-TABULAR--CONTENT-BITFLIP-001--ENV-AUTHOR--P1","B01-TABULAR--CONTENT-BITFLIP-001--ENV-AUTHOR--P2","B01-TABULAR--CONTENT-BITFLIP-001--ENV-AUTHOR--P3","B01-TABULAR--CONTENT-BITFLIP-001--ENV-LINUX-PINNED--P0","B01-TABULAR--CONTENT-BITFLIP-001--ENV-LINUX-PINNED--P1","B01-TABULAR--CONTENT-BITFLIP-001--ENV-LINUX-PINNED--P2","B01-TABULAR--CONTENT-BITFLIP-001--ENV-LINUX-PINNED--P3"],"not_evaluable_reasons":[],"planned_row_count":1480,"required_negative_wording":true,"status":"FALSIFIED_OR_INCOMPLETE","would_support_positive_wording":false},{"abstract_eligible":false,"category_counts":{"ACCEPT":0,"ERROR":0,"GENERATION_FAILURE":0,"MISSING_EXECUTION":0,"REJECT":0},"conclusion_eligible":false,"id":"PR-010","mismatch_count":0,"mismatch_row_ids":[],"not_evaluable_reasons":["the required stratum or evidence class is absent from this ledger"],"planned_row_count":0,"required_negative_wording":true,"status":"NOT_EVALUABLE","would_support_positive_wording":false},{"abstract_eligible":false,"category_counts":{"ACCEPT":0,"ERROR":0,"GENERATION_FAILURE":0,"MISSING_EXECUTION":0,"REJECT":0},"conclusion_eligible":false,"id":"PR-011","mismatch_count":0,"mismatch_row_ids":[],"not_evaluable_reasons":["the required stratum or evidence class is absent from this ledger"],"planned_row_count":0,"required_negative_wording":true,"status":"NOT_EVALUABLE","would_support_positive_wording":false},{"abstract_eligible":false,"category_counts":{"ACCEPT":0,"ERROR":0,"GENERATION_FAILURE":0,"MISSING_EXECUTION":0,"REJECT":0},"conclusion_eligible":false,"id":"PR-012","mismatch_count":0,"mismatch_row_ids":[],"not_evaluable_reasons":["the required stratum or evidence class is absent from this ledger"],"planned_row_count":0,"required_negative_wording":true,"status":"NOT_EVALUABLE","would_support_positive_wording":false}],"read_scope":{"confirmatory_artifacts_read":false,"dummy_input_only":true,"independent_review_performed":false,"model_outputs_read":false,"network_used":false},"schema_version":"amy.analysis-summary.v1-draft","target_invalid_breakdown":{"by_profile_and_family":[{"accepted_unit_ids":["B01-TABULAR--ATTESTATION-MALFORMED-001","B01-TABULAR--ATTESTATION-MISSING-001","B01-TABULAR--STATEMENT-MALFORMED-001","B02-PAPER--ATTESTATION-MALFORMED-001","B02-PAPER--ATTESTATION-MISSING-001","B02-PAPER--STATEMENT-MALFORMED-001","B03-MODEL--ATTESTATION-MALFORMED-001","B03-MODEL--ATTESTATION-MISSING-001","B03-MODEL--STATEMENT-MALFORMED-001","B04-SOFTWARE--ATTESTATION-MALFORMED-001","B04-SOFTWARE--ATTESTATION-MISSING-001","B04-SOFTWARE--STATEMENT-MALFORMED-001","B05-MODEL-EXCHANGE--ATTESTATION-MALFORMED-001","B05-MODEL-EXCHANGE--ATTESTATION-MISSING-001","B05-MODEL-EXCHANGE--STATEMENT-MALFORMED-001","B06-MIXED-RESEARCH--ATTESTATION-MALFORMED-001","B06-MIXED-RESEARCH--ATTESTATION-MISSING-001","B06-MIXED-RESEARCH--STATEMENT-MALFORMED-001"],"category_counts":{"ACCEPT":34,"ERROR":0,"GENERATION_FAILURE":1,"MISSING_EXECUTION":1,"REJECT":0},"operator_family":"attestation_structure","planned_row_count":36,"profile_id":"P0"},{"accepted_unit_ids":["B01-TABULAR--CERTIFICATE-TIME-001","B02-PAPER--CERTIFICATE-TIME-001","B03-MODEL--CERTIFICATE-TIME-001","B04-SOFTWARE--CERTIFICATE-TIME-001","B05-MODEL-EXCHANGE--CERTIFICATE-TIME-001","B06-MIXED-RESEARCH--CERTIFICATE-TIME-001"],"category_counts":{"ACCEPT":12,"ERROR":0,"GENERATION_FAILURE":0,"MISSING_EXECUTION":0,"REJECT":0},"operator_family":"certificate_policy",